{
  "schema": "szk.ma.validate-request/v1",
  "measure": "RR",
  "options": {
    "cc": 0.5,
    "cc_to": "only0",
    "drop00": null
  },
  "table": {
    "header": [
      "row_uid",
      "study",
      "e1",
      "n1",
      "e2",
      "n2",
      "rob",
      "estimated",
      "forras_oldal"
    ],
    "rows": [
      [
        "r7f3a2",
        "Aronson 1948",
        "4",
        "123",
        "11",
        "139",
        "low",
        "nem",
        "3"
      ]
    ],
    "decimal_mark": null
  },
  "base_sha256": "9f3a000000000000000000000000000000000000000000000000000000000000"
}
